<xs:schema attributeFormDefault="unqualified" elementFormDefault="qualified" xmlns:xs="http://www.w3.org/2001/XMLSchema">
 
  <xs:element name="article">
    <xs:complexType>
      <xs:sequence>
        <xs:element type="xs:string" name="title"/>
        <xs:element type="xs:string" name="date"/>
        <xs:element name="author">
          <xs:complexType>
            <xs:sequence>
              <xs:element type="xs:string" name="firstName"/>
              <xs:element type="xs:string" name="lastName"/>
            </xs:sequence>
          </xs:complexType>
        </xs:element>
        <xs:element type="xs:string" name="summary"/>
        <xs:element type="xs:string" name="content"/>
      </xs:sequence>
    </xs:complexType>
  </xs:element>
</xs:schema>