<?xml version = "1.0"?>

<article xmlns:xsi="http://www.w3.org/2001/XMLSchema-instance"
         xsi:noNamespaceSchemaLocation="/workspaces/Web-Client-Applications/chapter13-1-dtd/assets/Schema.xsd">

    <title>Simple XML</title>
    <date>July 4, 2007</date>
    <author>
        <firstName>John</firstName>
        <lastName>Doe</lastName>
    </author>
    <summary>XML is pretty easy.</summary>
    <content>This chapter presents examples that use XML.</content>
</article>